<?xml version="1.0" encoding="UTF-8" ?>
<flowers xmlns:xsi="http://www.w3.org/2001/XMLSchema-instance"
         xmlns="http://www.example.com/flowers"
         xsi:schemaLocation="http://www.example.com/flowers flowers.xsd">

    <flower name="" type-of-flower = "field"
        <soil>ground</soil>
        <origin>Altai</origin>
        <visual-parameters>
            <leaf-color>white</leaf-color>
            <steam-color>green</steam-color>
            <size>0.2 m</size>
        </visual-parameters>
        <multiplying>seeds</multiplying>
        <date-of-planting>2021-05-15</date-of-planting>
        <growing-tips>
            <temperature>20 degree</temperature>
            <lightning>light-loving</lightning>
            <watering>1000 ml</watering>
        </growing-tips>
    </flower>
    <tree id="a2" name="eucalyptus" max-age = "100">
        <soil>ground</soil>
        <origin>Australia</origin>
        <visual-parameters>
            <steam-color>brown</steam-color>
            <leaf-color>green</leaf-color>
            <size>30 m</size>
        </visual-parameters>
        <multiplying>cutting</multiplying>
        <date-of-planting>2021-03-20</date-of-planting>
        <growing-tips>
            <temperature>15 degree</temperature>
            <lightning>light-loving</lightning>
            <watering>1000000 ml</watering>
        </growing-tips>
    </tree>
</flowers>